{
  "schema_version": "1.0",
  "edition_key": "hctm-m9-incorporation-knowledge",
  "edition_version": "1.0.0",
  "iaos_edition": "genesis-m9@1.5.0",
  "iaos_process": "enterprise.incorporation.lifecycle.v1",
  "language": "zh-CN",
  "content_hash": "6a73c7735970e14adbbe198f5ebc07bd7b580cf6fc3f32da3137c3633efd6543",
  "articles": [
    {"article_id":"KB-M9-INCORPORATION","title":"M9 企业设立人机协作验收手册","source_ref":"docs/manuals/m9-incorporation-user-manual.md","applies_to_version":"hctm-m9-incorporation-knowledge@1.0.0"}
  ],
  "nodes": [
    {"sequence":1,"capability":"incorporation.case.open","task_type":"human_task","actor":"founder-principal","article_id":"KB-M9-INCORPORATION","purpose":"由创始人提交可追踪的设立意图并建立案件。","inputs":["案件编码、拟设企业名称、地址、经营范围"],"outputs":["incorporation_case 与节点运行证据"],"evidence_types":["entity","journal","outbox"],"iaos_menus":["enterprise_lifecycle","incorporation_cases"],"world_actions":[]},
    {"sequence":2,"capability":"founder.resolution.prepare","task_type":"agent_task","actor":"incorporation-agent","article_id":"KB-M9-INCORPORATION","purpose":"Agent 依据案件合同准备可审计的创始人决议草稿。","inputs":["设立案件、创始人业务说明"],"outputs":["governance_resolution 草稿与 Agent run"],"evidence_types":["entity","agent_run","journal"],"iaos_menus":["incorporation_tasks","incorporation_agents"],"world_actions":[]},
    {"sequence":3,"capability":"founder.resolution.approve","task_type":"approval","actor":"founder-principal","gate":"G1","article_id":"KB-M9-INCORPORATION","purpose":"有权主体审阅并批准设立决议。","inputs":["决议草稿、审批意见"],"outputs":["冻结审批请求与决定证据"],"evidence_types":["approval","journal"],"iaos_menus":["approvals","enterprise_lifecycle"],"world_actions":[]},
    {"sequence":4,"capability":"capital.commitment.record","task_type":"agent_task","actor":"finance-agent","article_id":"KB-M9-INCORPORATION","purpose":"记录股东出资承诺及币种、金额和履约条件。","inputs":["出资人、金额、币种、到期日"],"outputs":["capital_commitment"],"evidence_types":["entity","journal","outbox"],"iaos_menus":["incorporation_tasks","capital_commitment"],"world_actions":[]},
    {"sequence":5,"capability":"registration.package.validate","task_type":"agent_task","actor":"legal-compliance-agent","article_id":"KB-M9-INCORPORATION","purpose":"校验登记材料完整性且不伪造监管结果。","inputs":["案件、决议、出资承诺"],"outputs":["材料校验结果"],"evidence_types":["agent_run","journal"],"iaos_menus":["incorporation_tasks","incorporation_processes"],"world_actions":[]},
    {"sequence":6,"capability":"registration.submit","task_type":"approval","actor":"founder-principal","gate":"G2","article_id":"KB-M9-INCORPORATION","purpose":"批准向登记机构提交正式材料。","inputs":["材料包、提交说明"],"outputs":["登记提交意图"],"evidence_types":["approval","world_intent","outbox"],"iaos_menus":["approvals","enterprise_lifecycle"],"world_actions":[]},
    {"sequence":7,"capability":"registration.observation.commit","task_type":"world_wait","actor":"world-registry","article_id":"KB-M9-INCORPORATION","purpose":"接收登记机构可信 Observation 后形成法人登记事实。","inputs":["签名登记 Observation"],"outputs":["legal_entity 与 legal_registration"],"evidence_types":["world_observation","entity","journal"],"iaos_menus":["legal_entity","legal_registration"],"world_actions":["registrar.confirm_registration"]},
    {"sequence":8,"capability":"bank.account.opening.submit","task_type":"approval","actor":"founder-principal","gate":"G3","article_id":"KB-M9-INCORPORATION","purpose":"批准向银行发起对公账户开户。","inputs":["法人登记、开户资料"],"outputs":["银行开户意图"],"evidence_types":["approval","world_intent"],"iaos_menus":["approvals","bank_account"],"world_actions":[]},
    {"sequence":9,"capability":"bank.account.observation.commit","task_type":"world_wait","actor":"world-bank","article_id":"KB-M9-INCORPORATION","purpose":"接收银行可信 Observation 并登记银行账户。","inputs":["签名开户 Observation"],"outputs":["bank_account"],"evidence_types":["world_observation","entity","journal"],"iaos_menus":["bank_account","enterprise_lifecycle"],"world_actions":["bank.confirm_account_opened"]},
    {"sequence":10,"capability":"capital.contribution.verify","task_type":"agent_task","actor":"finance-agent","gate":"G4","article_id":"KB-M9-INCORPORATION","purpose":"核对银行到账事实并确认实缴资本。","inputs":["出资承诺、银行到账证据"],"outputs":["capital_contribution 与资本凭证"],"evidence_types":["entity","journal_entry","journal"],"iaos_menus":["capital_contribution","journal_entry"],"world_actions":[]},
    {"sequence":11,"capability":"organization.establish","task_type":"capability","actor":"iaos-runtime","article_id":"KB-M9-INCORPORATION","purpose":"依据法人事实建立初始组织骨架。","inputs":["legal_entity、组织模板"],"outputs":["组织单元与岗位"],"evidence_types":["entity","journal"],"iaos_menus":["org_explorer","organization_position"],"world_actions":[]},
    {"sequence":12,"capability":"executive.appointment.propose","task_type":"agent_task","actor":"governance-agent","article_id":"KB-M9-INCORPORATION","purpose":"准备高管任命建议与职责边界。","inputs":["组织岗位、候选主体"],"outputs":["executive_appointment 草稿"],"evidence_types":["entity","agent_run"],"iaos_menus":["incorporation_tasks","executive_appointment"],"world_actions":[]},
    {"sequence":13,"capability":"executive.appointment.acceptance.commit","task_type":"world_wait","actor":"world-talent","article_id":"KB-M9-INCORPORATION","purpose":"记录候选人的外部接受意愿。","inputs":["签名任职接受 Observation"],"outputs":["任职接受事实"],"evidence_types":["world_observation","journal"],"iaos_menus":["executive_appointment","enterprise_lifecycle"],"world_actions":["talent.accept_appointment"]},
    {"sequence":14,"capability":"executive.appointment.approve","task_type":"approval","actor":"founder-principal","gate":"G5","article_id":"KB-M9-INCORPORATION","purpose":"有权主体批准高管任命。","inputs":["任命建议、接受事实"],"outputs":["生效任命与岗位任职"],"evidence_types":["approval","entity","journal"],"iaos_menus":["approvals","organization_position"],"world_actions":[]},
    {"sequence":15,"capability":"operating.mandate.grant","task_type":"approval","actor":"founder-principal","gate":"G6","article_id":"KB-M9-INCORPORATION","purpose":"向经营岗位授予有范围、限额和期限的授权。","inputs":["受权主体、能力范围、金额上限、有效期"],"outputs":["operating_mandate"],"evidence_types":["approval","entity","journal"],"iaos_menus":["approvals","operating_mandate"],"world_actions":[]},
    {"sequence":16,"capability":"initial.budget.prepare","task_type":"agent_task","actor":"finance-agent","article_id":"KB-M9-INCORPORATION","purpose":"财务 Agent 准备开业预算草案。","inputs":["经营计划、组织范围、预算假设"],"outputs":["budget_envelope 草稿"],"evidence_types":["entity","agent_run"],"iaos_menus":["incorporation_tasks","budget_envelope"],"world_actions":[]},
    {"sequence":17,"capability":"initial.budget.approve","task_type":"approval","actor":"founder-principal","gate":"G7","article_id":"KB-M9-INCORPORATION","purpose":"审批开业预算并冻结责任范围。","inputs":["预算草案、审批意见"],"outputs":["生效 budget_envelope"],"evidence_types":["approval","entity","journal"],"iaos_menus":["approvals","budget_envelope"],"world_actions":[]},
    {"sequence":18,"capability":"enterprise.readiness.evaluate","task_type":"agent_task","actor":"audit-agent","article_id":"KB-M9-INCORPORATION","purpose":"独立评估治理、资本、组织、授权、预算和财务证据是否齐备。","inputs":["全链 Entity、审批、World 与账务证据"],"outputs":["经营就绪结论与缺口清单"],"evidence_types":["agent_run","journal","trace"],"iaos_menus":["enterprise_lifecycle","decision_audit","finance_workspace"],"world_actions":[]}
  ]
}
